{
  "format": "deckle-state",
  "version": 1,
  "writer_id": "11111111-1111-4111-8111-111111111111",
  "writer_name": "Desk",
  "subject": {
    "kind": "fresh",
    "paper_id": "11111111-1111-4111-8111-111111111111",
    "edition_id": "22222222-2222-4222-8222-222222222222",
    "manifest_sha256": "aaaaaaaaaaaaaaaaaaaaaaaaaaaaaaaaaaaaaaaaaaaaaaaaaaaaaaaaaaaaaaaa"
  },
  "revision": 1,
  "registers": [
    {
      "key": {
        "kind": "crossword_cell",
        "puzzle_id": "daily",
        "row": 0,
        "column": 0
      },
      "value": {
        "kind": "cell",
        "letter": "A"
      },
      "dot": {
        "writer_id": "11111111-1111-4111-8111-111111111111",
        "counter": 10
      },
      "context": {},
      "display_timestamp": "2026-10-28T12:00:00Z"
    }
  ]
}
