{
  "format": "deckle-state",
  "version": 1,
  "writer_id": "11111111-1111-4111-8111-111111111111",
  "writer_name": "Desk",
  "subject": {
    "kind": "fresh",
    "paper_id": "11111111-1111-4111-8111-111111111111",
    "edition_id": "22222222-2222-4222-8222-222222222222",
    "manifest_sha256": "aaaaaaaaaaaaaaaaaaaaaaaaaaaaaaaaaaaaaaaaaaaaaaaaaaaaaaaaaaaaaaaa"
  },
  "revision": 5,
  "registers": [
    {
      "key": {
        "kind": "last_location"
      },
      "value": {
        "kind": "anchor",
        "anchor": {
          "story_id": "2026-10-23/reading/1",
          "body_sha256": "aaaaaaaaaaaaaaaaaaaaaaaaaaaaaaaaaaaaaaaaaaaaaaaaaaaaaaaaaaaaaaaa",
          "utf16_offset": 12,
          "quote": "A paragraph."
        }
      },
      "dot": {
        "writer_id": "11111111-1111-4111-8111-111111111111",
        "counter": 1
      },
      "context": {},
      "display_timestamp": "2026-10-28T12:00:00Z"
    },
    {
      "key": {
        "kind": "story_position",
        "story_id": "2026-10-23/reading/1"
      },
      "value": {
        "kind": "anchor",
        "anchor": {
          "story_id": "2026-10-23/reading/1",
          "body_sha256": "aaaaaaaaaaaaaaaaaaaaaaaaaaaaaaaaaaaaaaaaaaaaaaaaaaaaaaaaaaaaaaaa",
          "utf16_offset": 12,
          "quote": "A paragraph."
        }
      },
      "dot": {
        "writer_id": "11111111-1111-4111-8111-111111111111",
        "counter": 2
      },
      "context": {
        "11111111-1111-4111-8111-111111111111": 1
      },
      "display_timestamp": "2026-10-28T12:00:00Z"
    },
    {
      "key": {
        "kind": "ladder",
        "puzzle_id": "2026-10-23/puzzle/1"
      },
      "value": {
        "kind": "ladder",
        "words": [
          "COLD",
          "CORD",
          "CARD"
        ]
      },
      "dot": {
        "writer_id": "11111111-1111-4111-8111-111111111111",
        "counter": 3
      },
      "context": {
        "11111111-1111-4111-8111-111111111111": 2
      },
      "display_timestamp": "2026-10-28T12:00:00Z"
    },
    {
      "key": {
        "kind": "mark",
        "id": "11111111-1111-4111-8111-111111111111"
      },
      "value": {
        "kind": "mark",
        "mark": {
          "id": "11111111-1111-4111-8111-111111111111",
          "story_id": "2026-10-23/reading/1",
          "body_sha256": "aaaaaaaaaaaaaaaaaaaaaaaaaaaaaaaaaaaaaaaaaaaaaaaaaaaaaaaaaaaaaaaa",
          "range": {
            "location": 0,
            "length": 5
          },
          "quote": "Hello",
          "note": "First note"
        }
      },
      "dot": {
        "writer_id": "11111111-1111-4111-8111-111111111111",
        "counter": 4
      },
      "context": {
        "11111111-1111-4111-8111-111111111111": 3
      },
      "display_timestamp": "2026-10-28T12:00:00Z"
    },
    {
      "key": {
        "kind": "crossword_cell",
        "puzzle_id": "2026-10-23/puzzle/1",
        "row": 0,
        "column": 0
      },
      "value": {
        "kind": "cell",
        "letter": "A"
      },
      "dot": {
        "writer_id": "11111111-1111-4111-8111-111111111111",
        "counter": 5
      },
      "context": {
        "11111111-1111-4111-8111-111111111111": 4
      },
      "display_timestamp": "2026-10-28T12:00:00Z"
    }
  ]
}
